<xs:schema xmlns:xs="http://www.w3.org/2001/XMLSchema">

  <xs:element name="autores">
    <xs:complexType>
      <xs:sequence>
        <xs:element name="autor" maxOccurs="unbounded">
          <xs:complexType>
            <xs:sequence>
              <xs:element name="nome" type="xs:string"/>
              <xs:element name="email" type="xs:string"/>
              <xs:element name="numero" type="xs:integer"/>
            </xs:sequence>
          </xs:complexType>
        </xs:element>
      </xs:sequence>
    </xs:complexType>
  </xs:element>

</xs:schema>